{"collection_id":"lcd-institutional-live","description":"Live public institutional pages from LCD, frozen from one trusted producer run.","items":[{"canonical_url":"https://lcd.exactas.uba.ar/novedades/mujeres-de-exactas/","contributors":[],"facets":{"entity_type":"page"},"item_id":"lcd:page:1135","kind":"lcd-page","source_ref":{"authority":"repo.lcd-uba-knowledgebase","object_id":"page:1135","url":"https://lcd.exactas.uba.ar/novedades/mujeres-de-exactas/"},"subtitle":"page","tags":[],"title":"Mujeres de Exactas"},{"canonical_url":"https://lcd.exactas.uba.ar/datame/","contributors":[],"facets":{"entity_type":"page"},"item_id":"lcd:page:1183","kind":"lcd-page","source_ref":{"authority":"repo.lcd-uba-knowledgebase","object_id":"page:1183","url":"https://lcd.exactas.uba.ar/datame/"},"subtitle":"page","tags":[],"title":"¡Dátame! Las charlas de LCD"},{"canonical_url":"https://lcd.exactas.uba.ar/semana-de-las-ciencias-de-datos-2021/","contributors":[],"facets":{"entity_type":"page"},"item_id":"lcd:page:1225","kind":"lcd-page","source_ref":{"authority":"repo.lcd-uba-knowledgebase","object_id":"page:1225","url":"https://lcd.exactas.uba.ar/semana-de-las-ciencias-de-datos-2021/"},"subtitle":"page","tags":[],"title":"Semana de las Ciencias de Datos 2021"},{"canonical_url":"https://lcd.exactas.uba.ar/employee-circle-panel-grid/","contributors":[],"facets":{"entity_type":"page"},"item_id":"lcd:page:1434","kind":"lcd-page","source_ref":{"authority":"repo.lcd-uba-knowledgebase","object_id":"page:1434","url":"https://lcd.exactas.uba.ar/employee-circle-panel-grid/"},"subtitle":"page","tags":[],"title":"Employee Circle Panel Grid"},{"canonical_url":"https://lcd.exactas.uba.ar/employee-circle-grid/","contributors":[],"facets":{"entity_type":"page"},"item_id":"lcd:page:1435","kind":"lcd-page","source_ref":{"authority":"repo.lcd-uba-knowledgebase","object_id":"page:1435","url":"https://lcd.exactas.uba.ar/employee-circle-grid/"},"subtitle":"page","tags":[],"title":"Employee Circle Grid"},{"canonical_url":"https://lcd.exactas.uba.ar/horarios-de-consulta/","contributors":[],"facets":{"entity_type":"page"},"item_id":"lcd:page:1864","kind":"lcd-page","source_ref":{"authority":"repo.lcd-uba-knowledgebase","object_id":"page:1864","url":"https://lcd.exactas.uba.ar/horarios-de-consulta/"},"subtitle":"page","tags":[],"title":"Horarios de consulta"},{"canonical_url":"https://lcd.exactas.uba.ar/quiero-ser-tutor-a/","contributors":[],"facets":{"entity_type":"page"},"item_id":"lcd:page:1948","kind":"lcd-page","source_ref":{"authority":"repo.lcd-uba-knowledgebase","object_id":"page:1948","url":"https://lcd.exactas.uba.ar/quiero-ser-tutor-a/"},"subtitle":"page","tags":[],"title":"Quiero ser tutor/a"},{"canonical_url":"https://lcd.exactas.uba.ar/quiero-ser-director-a/","contributors":[],"facets":{"entity_type":"page"},"item_id":"lcd:page:1951","kind":"lcd-page","source_ref":{"authority":"repo.lcd-uba-knowledgebase","object_id":"page:1951","url":"https://lcd.exactas.uba.ar/quiero-ser-director-a/"},"subtitle":"page","tags":[],"title":"Quiero ser director/a"},{"canonical_url":"https://lcd.exactas.uba.ar/pagina-ejemplo/","contributors":[],"facets":{"entity_type":"page"},"item_id":"lcd:page:2","kind":"lcd-page","source_ref":{"authority":"repo.lcd-uba-knowledgebase","object_id":"page:2","url":"https://lcd.exactas.uba.ar/pagina-ejemplo/"},"subtitle":"page","tags":[],"title":"Página de ejemplo"},{"canonical_url":"https://lcd.exactas.uba.ar/temas-de-tesis-de-licenciatura-bak/","contributors":[],"facets":{"entity_type":"page"},"item_id":"lcd:page:2147","kind":"lcd-page","source_ref":{"authority":"repo.lcd-uba-knowledgebase","object_id":"page:2147","url":"https://lcd.exactas.uba.ar/temas-de-tesis-de-licenciatura-bak/"},"subtitle":"page","tags":[],"title":"Cartelera de temas de tesis de licenciatura – BAK"},{"canonical_url":"https://lcd.exactas.uba.ar/archivo-de-tesis-de-licenciatura-bak/","contributors":[],"facets":{"entity_type":"page"},"item_id":"lcd:page:2562","kind":"lcd-page","source_ref":{"authority":"repo.lcd-uba-knowledgebase","object_id":"page:2562","url":"https://lcd.exactas.uba.ar/archivo-de-tesis-de-licenciatura-bak/"},"subtitle":"page","tags":[],"title":"Archivo de tesis de licenciatura – BAK"},{"canonical_url":"https://lcd.exactas.uba.ar/no-access/","contributors":[],"facets":{"entity_type":"page"},"item_id":"lcd:page:2940","kind":"lcd-page","source_ref":{"authority":"repo.lcd-uba-knowledgebase","object_id":"page:2940","url":"https://lcd.exactas.uba.ar/no-access/"},"subtitle":"page","tags":[],"title":"No Access"},{"canonical_url":"https://lcd.exactas.uba.ar/","contributors":[],"facets":{"entity_type":"page"},"item_id":"lcd:page:395","kind":"lcd-page","source_ref":{"authority":"repo.lcd-uba-knowledgebase","object_id":"page:395","url":"https://lcd.exactas.uba.ar/"},"subtitle":"page","tags":[],"title":"Home"},{"canonical_url":"https://lcd.exactas.uba.ar/institucional/","contributors":[],"facets":{"entity_type":"page"},"item_id":"lcd:page:410","kind":"lcd-page","source_ref":{"authority":"repo.lcd-uba-knowledgebase","object_id":"page:410","url":"https://lcd.exactas.uba.ar/institucional/"},"subtitle":"page","tags":[],"title":"Institucional"},{"canonical_url":"https://lcd.exactas.uba.ar/novedades/","contributors":[],"facets":{"entity_type":"page"},"item_id":"lcd:page:412","kind":"lcd-page","source_ref":{"authority":"repo.lcd-uba-knowledgebase","object_id":"page:412","url":"https://lcd.exactas.uba.ar/novedades/"},"subtitle":"page","tags":[],"title":"Novedades"},{"canonical_url":"https://lcd.exactas.uba.ar/materias/","contributors":[],"facets":{"entity_type":"page"},"item_id":"lcd:page:43","kind":"lcd-page","source_ref":{"authority":"repo.lcd-uba-knowledgebase","object_id":"page:43","url":"https://lcd.exactas.uba.ar/materias/"},"subtitle":"page","tags":[],"title":"Plan de estudios"},{"canonical_url":"https://lcd.exactas.uba.ar/preguntas-frecuentes/","contributors":[],"facets":{"entity_type":"page"},"item_id":"lcd:page:480","kind":"lcd-page","source_ref":{"authority":"repo.lcd-uba-knowledgebase","object_id":"page:480","url":"https://lcd.exactas.uba.ar/preguntas-frecuentes/"},"subtitle":"page","tags":[],"title":"Preguntas Frecuentes"},{"canonical_url":"https://lcd.exactas.uba.ar/comisiones/","contributors":[],"facets":{"entity_type":"page"},"item_id":"lcd:page:650","kind":"lcd-page","source_ref":{"authority":"repo.lcd-uba-knowledgebase","object_id":"page:650","url":"https://lcd.exactas.uba.ar/comisiones/"},"subtitle":"page","tags":[],"title":"Comisión de Carrera Original"},{"canonical_url":"https://lcd.exactas.uba.ar/comision-de-carrera/","contributors":[],"facets":{"entity_type":"page"},"item_id":"lcd:page:807","kind":"lcd-page","source_ref":{"authority":"repo.lcd-uba-knowledgebase","object_id":"page:807","url":"https://lcd.exactas.uba.ar/comision-de-carrera/"},"subtitle":"page","tags":[],"title":"Comisión de Carrera"}],"payload_sha256":"582187c7ac71a1010788149cfd6a13b16b8d29081eff9e3a6e3993cd55b8c59c","release_id":"sha256:582187c7ac71a101","schema_id":"knowledge.collection-release","schema_version":1,"source":{"adapter":"lcd-title-slug-index","authority":"repo.lcd-uba-knowledgebase","path":"source/title_slug_index.json","release_id":"run:kx_live_lcd_pages_20260829T221634Z;git:dcaa61e338b284d43764b9c06a0f112629e958f6","sha256":"66898ae81d7203bac9e7ca77ed3139dced8ff6c2c9f3c1855a88f1a13861a2a2"},"spec_sha256":"ba6e8e01077dfa589634444562dbddb3233deaf2d658302e7543b65c68cea508","title":"LCD — institutional pages"}
