{"collection_id":"thesis-bibliography","description":"Nineteen papers from the governed tesis-cited Paper KB fixture, preserved as one exact bibliographic source release.","items":[{"contributors":["Jun-Peng Jiang","Si-Yang Liu","Hao-Run Cai","Qile Zhou","Han-Jia Ye"],"facets":{"author":["Jun-Peng Jiang","Si-Yang Liu","Hao-Run Cai","Qile Zhou","Han-Jia Ye"]},"item_id":"paper_128812daa4","kind":"paper","source_ref":{"authority":"repo.paper-kb","object_id":"paper_128812daa4"},"tags":[],"title":"Representation Learning for Tabular Data: A Comprehensive Survey"},{"contributors":["Vadim Borisov","Tobias Leemann","Kathrin Seßler","Johannes Haug","Martin Pawelczyk","Gjergji Kasneci"],"facets":{"author":["Vadim Borisov","Tobias Leemann","Kathrin Seßler","Johannes Haug","Martin Pawelczyk","Gjergji Kasneci"]},"item_id":"paper_1c049998c3","kind":"paper","source_ref":{"authority":"repo.paper-kb","object_id":"paper_1c049998c3"},"tags":[],"title":"Deep Neural Networks and Tabular Data: A Survey"},{"contributors":["Nora Lustig","Andrea Vigorito","Inequality Vigorito","Facundo Alvaredo","François Bourguignon","Mauricio De Rosa","Francisco Ferreira","Emmanuel Flachaire","Stephen Jenkins","Graciela Sanroman","Mathias Silva","Philippe Kerm","Paulo Verme","Joan Vilá"],"facets":{"author":["Nora Lustig","Andrea Vigorito","Inequality Vigorito","Facundo Alvaredo","François Bourguignon","Mauricio De Rosa","Francisco Ferreira","Emmanuel Flachaire","Stephen Jenkins","Graciela Sanroman","Mathias Silva","Philippe Kerm","Paulo Verme","Joan Vilá"]},"item_id":"paper_2efc11a378","kind":"paper","source_ref":{"authority":"repo.paper-kb","object_id":"paper_2efc11a378"},"tags":[],"title":"The \"Missing Rich\" in Household Surveys: Causes and Correction Approaches Extended Version with Technical Appendixes"},{"contributors":["Angus Deaton"],"facets":{"author":["Angus Deaton"]},"item_id":"paper_340915ba55","kind":"paper","source_ref":{"authority":"repo.paper-kb","object_id":"paper_340915ba55"},"tags":[],"title":"Household Surveys, Consumption, and the Measurement of Poverty"},{"contributors":["Neeti Pokhriyal","Omar Zambrano","Jennifer Linares","Hugo Hernández","Felipe Library"],"facets":{"author":["Neeti Pokhriyal","Omar Zambrano","Jennifer Linares","Hugo Hernández","Felipe Library"]},"item_id":"paper_3d71558b74","kind":"paper","source_ref":{"authority":"repo.paper-kb","object_id":"paper_3d71558b74"},"tags":[],"title":"Estimating and Forecasting Income Poverty and Inequality in Haiti using Satellite Imagery and Mobile Phone data"},{"contributors":["Pei Xue","Tianshun Li"],"facets":{"author":["Pei Xue","Tianshun Li"]},"item_id":"paper_5509a434ee","kind":"paper","source_ref":{"authority":"repo.paper-kb","object_id":"paper_5509a434ee"},"tags":[],"title":"A supervised variational autoencoder framework for dimensionality reduction and predictive modeling in high-dimensional socioeconomic data"},{"contributors":["Chris Elbers","Jean Lanjouw","Peter Lanjouw"],"facets":{"author":["Chris Elbers","Jean Lanjouw","Peter Lanjouw"]},"item_id":"paper_6d178dba40","kind":"paper","source_ref":{"authority":"repo.paper-kb","object_id":"paper_6d178dba40"},"tags":[],"title":"MICRO-LEVEL ESTIMATION OF POVERTY AND INEQUALITY"},{"contributors":["Daniela Gomez-Cravioto","Ramon Diaz-Ramos","Neil Hernandez-Gress","Jose Preciado","Hector Ceballos"],"facets":{"author":["Daniela Gomez-Cravioto","Ramon Diaz-Ramos","Neil Hernandez-Gress","Jose Preciado","Hector Ceballos"]},"item_id":"paper_70ab083def","kind":"paper","source_ref":{"authority":"repo.paper-kb","object_id":"paper_70ab083def"},"tags":[],"title":"Supervised machine learning predictive analytics for alumni income"},{"contributors":["Shajara Ul‐durar","Konstantinos Dimitriadis","Noman Arshed","Marco De Sisto","Hamidreza Harati"],"facets":{"author":["Shajara Ul‐durar","Konstantinos Dimitriadis","Noman Arshed","Marco De Sisto","Hamidreza Harati"]},"item_id":"paper_7176054ca2","kind":"paper","source_ref":{"authority":"repo.paper-kb","object_id":"paper_7176054ca2"},"tags":[],"title":"Distributional and Tail‐Dependent Perspectives in Economic Relationships: A Review of Quantile Regression Application"},{"contributors":["Nicolás Abbate","Leonardo Gasparini","Franco Ronchetti","Facundo Quiroga"],"facets":{"author":["Nicolás Abbate","Leonardo Gasparini","Franco Ronchetti","Facundo Quiroga"]},"item_id":"paper_748063eee0","kind":"paper","source_ref":{"authority":"repo.paper-kb","object_id":"paper_748063eee0"},"tags":[],"title":"Deep learning with satellite images enables high-resolution income estimation: A case study of Buenos Aires"},{"contributors":["Alessandro Tarozzi","Angus Deaton"],"facets":{"author":["Alessandro Tarozzi","Angus Deaton"]},"item_id":"paper_7eac0538e3","kind":"paper","source_ref":{"authority":"repo.paper-kb","object_id":"paper_7eac0538e3"},"tags":[],"title":"Using Census and Survey Data to Estimate Poverty and Inequality for Small Areas"},{"contributors":["Yuan Zhao","Ronak Paul","Sean Reid","Carolina Coimbra Vieira","Chris Wolfe","Yan Zhang","Rumi Chunara"],"facets":{"author":["Yuan Zhao","Ronak Paul","Sean Reid","Carolina Coimbra Vieira","Chris Wolfe","Yan Zhang","Rumi Chunara"]},"item_id":"paper_84251d85e5","kind":"paper","source_ref":{"authority":"repo.paper-kb","object_id":"paper_84251d85e5"},"tags":[],"title":"Constructing Social Vulnerability Indexes with Increased Data and Machine Learning Highlight the Importance of Wealth Across Global Contexts"},{"contributors":["Vladimir Hlasny","Lidia Ceriani","Paolo Verme"],"facets":{"author":["Vladimir Hlasny","Lidia Ceriani","Paolo Verme"]},"item_id":"paper_9a294caf51","kind":"paper","source_ref":{"authority":"repo.paper-kb","object_id":"paper_9a294caf51"},"tags":[],"title":"Bottom incomes and the measurement of poverty and inequality *"},{"contributors":["Paul Corral","Heath Henderson","Sandra Segovia"],"facets":{"author":["Paul Corral","Heath Henderson","Sandra Segovia"]},"item_id":"paper_9b28a5da38","kind":"paper","source_ref":{"authority":"repo.paper-kb","object_id":"paper_9b28a5da38"},"tags":[],"title":"Poverty Mapping in the Age of Machine Learning"},{"contributors":["Nora Lustig"],"facets":{"author":["Nora Lustig"]},"item_id":"paper_a029188383","kind":"paper","source_ref":{"authority":"repo.paper-kb","object_id":"paper_a029188383"},"tags":[],"title":"Measuring the Distribution of Household Income, Consumption and Wealth: State of Play and Measurement Challenges"},{"contributors":["Maria Sahakyan","Zeyar Aung","Talal Rahwan"],"facets":{"author":["Maria Sahakyan","Zeyar Aung","Talal Rahwan"]},"item_id":"paper_b291930ece","kind":"paper","source_ref":{"authority":"repo.paper-kb","object_id":"paper_b291930ece"},"tags":[],"title":"Explainable Artificial Intelligence for Tabular Data: A Survey"},{"contributors":["Giulio Grossi","Emilia Rocco"],"facets":{"author":["Giulio Grossi","Emilia Rocco"]},"item_id":"paper_bb694a01f4","kind":"paper","source_ref":{"authority":"repo.paper-kb","object_id":"paper_bb694a01f4"},"tags":[],"title":"Developing a Synthetic Socio-Economic Index through Autoencoders: Evidence from Florence's Suburban Areas"},{"contributors":["Roger Koenker","Kevin Hallock","William Mckinley"],"facets":{"author":["Roger Koenker","Kevin Hallock","William Mckinley"]},"item_id":"paper_e7a7e60fef","kind":"paper","source_ref":{"authority":"repo.paper-kb","object_id":"paper_e7a7e60fef"},"tags":[],"title":"Quantile Regression"},{"contributors":["Ravi Varma","Kumar Bevara","Isabelle Wagenvoord","Farahnaz Hosseini","Himanshu Sharma","Vandana Nunna","Ting Xiao"],"facets":{"author":["Ravi Varma","Kumar Bevara","Isabelle Wagenvoord","Farahnaz Hosseini","Himanshu Sharma","Vandana Nunna","Ting Xiao"]},"item_id":"paper_e980a82fb9","kind":"paper","source_ref":{"authority":"repo.paper-kb","object_id":"paper_e980a82fb9"},"tags":[],"title":"Census2Vec: Enhancing Socioeconomic Predictive Models with Geo-Embedded Data"}],"payload_sha256":"a766463507d2f5ccecea04561157a4f70132ba5d96937b5bba2335a47cd39c94","release_id":"sha256:a766463507d2f5cc","schema_id":"knowledge.collection-release","schema_version":1,"source":{"adapter":"paper-catalog-jsonl","authority":"repo.paper-kb","path":"source/paper.catalog-record.v1.jsonl","release_id":"paper-kb:e82e82deb646f30707306cd13ff8ba279c8bad50:tesis-cited:catalog:sha256:648d8461929629e5b13385510048f77ead7000b98318fdf87d22fe9332f28a1f","sha256":"648d8461929629e5b13385510048f77ead7000b98318fdf87d22fe9332f28a1f"},"spec_sha256":"865703fa34d473c36ad27549b690b9f9d7282f14a476c51fc574d7558a710296","title":"Thesis bibliography"}
