{"collection_id":"fcv-literature-corpus","description":"Seven-paper governed seed corpus drawn from the real eric-mv Paper KB fixture. This is an intentionally bounded first FCV literature slice, not a claim of complete FCV coverage.","items":[{"contributors":["Michael Gilligan","Eric Mvukiyehe","Cyrus Samii"],"facets":{"author":["Michael Gilligan","Eric Mvukiyehe","Cyrus Samii"]},"item_id":"paper_33caccb865","kind":"paper","source_ref":{"authority":"repo.paper-kb","object_id":"paper_33caccb865"},"tags":[],"title":"Reintegrating rebels into civilian life: Quasi-experimental evidence from Burundi *"},{"contributors":["Eric Mvukiyehe","Cyrus Samii"],"facets":{"author":["Eric Mvukiyehe","Cyrus Samii"]},"item_id":"paper_3e740d9241","kind":"paper","source_ref":{"authority":"repo.paper-kb","object_id":"paper_3e740d9241"},"tags":[],"title":"Peacekeeping and development in fragile states: Micro-level evidence from Liberia"},{"contributors":["Ana Dammert","Eric Mvukiyehe","Furio Rosati"],"facets":{"author":["Ana Dammert","Eric Mvukiyehe","Furio Rosati"]},"item_id":"paper_81c971757e","kind":"paper","source_ref":{"authority":"repo.paper-kb","object_id":"paper_81c971757e"},"tags":[],"title":"Effects of Public Policy on Child Labor Current Knowledge, Gaps, and Implications for Program Design"},{"contributors":["Eric Mvukiyehe","Cyrus Samii"],"facets":{"author":["Eric Mvukiyehe","Cyrus Samii"]},"item_id":"paper_b7ecbe5407","kind":"paper","source_ref":{"authority":"repo.paper-kb","object_id":"paper_b7ecbe5407"},"tags":[],"title":"Promoting Democracy in Fragile States: Field Experimental Evidence from Liberia"},{"contributors":["Kate Baldwin","Eric Mvukiyehe","Alexander Hamilton"],"facets":{"author":["Kate Baldwin","Eric Mvukiyehe","Alexander Hamilton"]},"item_id":"paper_cd697612bb","kind":"paper","source_ref":{"authority":"repo.paper-kb","object_id":"paper_cd697612bb"},"tags":[],"title":"The Effects of Participatory Processes for Selecting Leaders: Evidence from Changes to Traditional Institutions in Liberia *"},{"contributors":["Jules Gazeaud","Nausheen Khan","Eric Mvukiyehe","Olivier Sterck"],"facets":{"author":["Jules Gazeaud","Nausheen Khan","Eric Mvukiyehe","Olivier Sterck"]},"item_id":"paper_e00377e265","kind":"paper","source_ref":{"authority":"repo.paper-kb","object_id":"paper_e00377e265"},"tags":[],"title":"With or without him? Experimental evidence on cash grants and gender-sensitive trainings in Tunisia"},{"contributors":["Ellis Goldberg","Erik Wibbels","Eric Mvukiyehe"],"facets":{"author":["Ellis Goldberg","Erik Wibbels","Eric Mvukiyehe"]},"item_id":"paper_e041365df8","kind":"paper","source_ref":{"authority":"repo.paper-kb","object_id":"paper_e041365df8"},"tags":[],"title":"Lessons from Strange Cases"}],"payload_sha256":"010486a65a5888d2267acc5122cd2fb672a58858806a4e5f280e5f52c557b71e","release_id":"sha256:010486a65a5888d2","schema_id":"knowledge.collection-release","schema_version":1,"source":{"adapter":"paper-catalog-jsonl","authority":"repo.paper-kb","path":"source/paper.catalog-record.v1.jsonl","release_id":"paper-kb:e82e82deb646f30707306cd13ff8ba279c8bad50:eric-mv:catalog:sha256:273a484b873d5ae6f9041b24e3c8b4906d23d0683b26941c95713665353f1b41","sha256":"273a484b873d5ae6f9041b24e3c8b4906d23d0683b26941c95713665353f1b41"},"spec_sha256":"8ead1dc3882213a58af4561962e55df734936b9d100b908f4ced7babb4cacabf","title":"FCV literature seed corpus — Eric Mvukiyehe"}
