{"collection_id":"author-works","description":"A real author-facet projection over the governed tesis-cited Paper KB catalog; the source corpus has nineteen papers and this collection selects the two records attributed to Angus Deaton.","items":[{"contributors":["Angus Deaton"],"facets":{"author":["Angus Deaton"]},"item_id":"paper_340915ba55","kind":"paper","source_ref":{"authority":"repo.paper-kb","object_id":"paper_340915ba55"},"tags":[],"title":"Household Surveys, Consumption, and the Measurement of Poverty"},{"contributors":["Alessandro Tarozzi","Angus Deaton"],"facets":{"author":["Alessandro Tarozzi","Angus Deaton"]},"item_id":"paper_7eac0538e3","kind":"paper","source_ref":{"authority":"repo.paper-kb","object_id":"paper_7eac0538e3"},"tags":[],"title":"Using Census and Survey Data to Estimate Poverty and Inequality for Small Areas"}],"payload_sha256":"646d6b43072e15b4c4285544518329e9757431dae3da5e5aaf935f735bc74a7f","release_id":"sha256:646d6b43072e15b4","schema_id":"knowledge.collection-release","schema_version":1,"source":{"adapter":"paper-catalog-jsonl","authority":"repo.paper-kb","path":"../thesis-bibliography/source/paper.catalog-record.v1.jsonl","release_id":"paper-kb:e82e82deb646f30707306cd13ff8ba279c8bad50:tesis-cited:catalog:sha256:648d8461929629e5b13385510048f77ead7000b98318fdf87d22fe9332f28a1f","sha256":"648d8461929629e5b13385510048f77ead7000b98318fdf87d22fe9332f28a1f"},"spec_sha256":"34811a5b234ca33b1dac39281a9576a7c8ed2cf14df4d1992b0eff7740d001ac","title":"Angus Deaton works in the thesis corpus"}
