{"collection_id":"economic-complexity-reading-path","description":"Six-step producer-curated Trail B from the exact Thesis programme; editorial sequence is collection meaning.","items":[{"canonical_url":"https://github.com/matuteiglesias/thesis/blob/7265018750db0f96b69efd4048aedad06ad803fc/docs/Location-Quotients/chapter2_18.md","contributors":[],"facets":{"source_path":"docs/Location-Quotients/chapter2_18.md","top_level":"Location-Quotients"},"item_id":"repo.thesis:docs/Location-Quotients/chapter2_18.md","kind":"research-document","source_ref":{"authority":"repo.thesis","object_id":"docs/Location-Quotients/chapter2_18.md","url":"https://github.com/matuteiglesias/thesis/blob/7265018750db0f96b69efd4048aedad06ad803fc/docs/Location-Quotients/chapter2_18.md"},"tags":["mathematics","economics","volatility"],"title":"Observations in the LQ Problem"},{"canonical_url":"https://github.com/matuteiglesias/thesis/blob/7265018750db0f96b69efd4048aedad06ad803fc/docs/Location-Quotients/chapter2_06.md","contributors":[],"facets":{"source_path":"docs/Location-Quotients/chapter2_06.md","top_level":"Location-Quotients"},"item_id":"repo.thesis:docs/Location-Quotients/chapter2_06.md","kind":"research-document","source_ref":{"authority":"repo.thesis","object_id":"docs/Location-Quotients/chapter2_06.md","url":"https://github.com/matuteiglesias/thesis/blob/7265018750db0f96b69efd4048aedad06ad803fc/docs/Location-Quotients/chapter2_06.md"},"tags":["Economics","Data Analysis","Location Quotient"],"title":"A Convenient Framework for Working with Location Quotient Values"},{"canonical_url":"https://github.com/matuteiglesias/thesis/blob/7265018750db0f96b69efd4048aedad06ad803fc/docs/Location-Quotients/chapter2_12.md","contributors":[],"facets":{"source_path":"docs/Location-Quotients/chapter2_12.md","top_level":"Location-Quotients"},"item_id":"repo.thesis:docs/Location-Quotients/chapter2_12.md","kind":"research-document","source_ref":{"authority":"repo.thesis","object_id":"docs/Location-Quotients/chapter2_12.md","url":"https://github.com/matuteiglesias/thesis/blob/7265018750db0f96b69efd4048aedad06ad803fc/docs/Location-Quotients/chapter2_12.md"},"tags":["pLQ","economics","trade","patents"],"title":"Characterization of pLQ"},{"canonical_url":"https://github.com/matuteiglesias/thesis/blob/7265018750db0f96b69efd4048aedad06ad803fc/docs/Location-Quotients/chapter2_08.md","contributors":[],"facets":{"source_path":"docs/Location-Quotients/chapter2_08.md","top_level":"Location-Quotients"},"item_id":"repo.thesis:docs/Location-Quotients/chapter2_08.md","kind":"research-document","source_ref":{"authority":"repo.thesis","object_id":"docs/Location-Quotients/chapter2_08.md","url":"https://github.com/matuteiglesias/thesis/blob/7265018750db0f96b69efd4048aedad06ad803fc/docs/Location-Quotients/chapter2_08.md"},"tags":["economics","probability","location quotient"],"title":"The Probabilistic Location Quotient"},{"canonical_url":"https://github.com/matuteiglesias/thesis/blob/7265018750db0f96b69efd4048aedad06ad803fc/docs/Location-Quotients/chapter2_07.md","contributors":[],"facets":{"source_path":"docs/Location-Quotients/chapter2_07.md","top_level":"Location-Quotients"},"item_id":"repo.thesis:docs/Location-Quotients/chapter2_07.md","kind":"research-document","source_ref":{"authority":"repo.thesis","object_id":"docs/Location-Quotients/chapter2_07.md","url":"https://github.com/matuteiglesias/thesis/blob/7265018750db0f96b69efd4048aedad06ad803fc/docs/Location-Quotients/chapter2_07.md"},"tags":["empirical","data analysis","logarithmic transformation"],"title":"Empirical Distributions"},{"canonical_url":"https://github.com/matuteiglesias/thesis/blob/7265018750db0f96b69efd4048aedad06ad803fc/docs/Location-Quotients/chapter2_19.md","contributors":[],"facets":{"source_path":"docs/Location-Quotients/chapter2_19.md","top_level":"Location-Quotients"},"item_id":"repo.thesis:docs/Location-Quotients/chapter2_19.md","kind":"research-document","source_ref":{"authority":"repo.thesis","object_id":"docs/Location-Quotients/chapter2_19.md","url":"https://github.com/matuteiglesias/thesis/blob/7265018750db0f96b69efd4048aedad06ad803fc/docs/Location-Quotients/chapter2_19.md"},"tags":["location-quotients","empirical-analysis","size-distortions"],"title":"Conclusion on Location Quotients"}],"payload_sha256":"1301c8bd650a44c7b85cfc618c19230075adf4ccec44bb192bb83d67202cd52a","release_id":"sha256:1301c8bd650a44c7","schema_id":"knowledge.collection-release","schema_version":1,"source":{"adapter":"jsonl","authority":"repo.thesis","path":"../economics-of-aggregation-programme/source/items.jsonl","release_id":"git:7265018750db0f96b69efd4048aedad06ad803fc","sha256":"e2c897121a5ed1786ef995250dfd30f7e90041abf0d166e34b3dbe7afb408556"},"spec_sha256":"abefc4c30f696119830b415ed617f2651845f749c6e95cc4253f10dc0e3f95ce","title":"Economic complexity — location-quotient problem reading path"}
