{"collection_id":"lcd-thesis-resources-live","description":"Curated thesis-related LCD pages selected by exact identities from the trusted live institutional-page release.","items":[{"canonical_url":"https://lcd.exactas.uba.ar/quiero-ser-tutor-a/","contributors":[],"facets":{"entity_type":"page"},"item_id":"lcd:page:1948","kind":"lcd-page","source_ref":{"authority":"repo.lcd-uba-knowledgebase","object_id":"page:1948","url":"https://lcd.exactas.uba.ar/quiero-ser-tutor-a/"},"subtitle":"page","tags":[],"title":"Quiero ser tutor/a"},{"canonical_url":"https://lcd.exactas.uba.ar/quiero-ser-director-a/","contributors":[],"facets":{"entity_type":"page"},"item_id":"lcd:page:1951","kind":"lcd-page","source_ref":{"authority":"repo.lcd-uba-knowledgebase","object_id":"page:1951","url":"https://lcd.exactas.uba.ar/quiero-ser-director-a/"},"subtitle":"page","tags":[],"title":"Quiero ser director/a"},{"canonical_url":"https://lcd.exactas.uba.ar/temas-de-tesis-de-licenciatura-bak/","contributors":[],"facets":{"entity_type":"page"},"item_id":"lcd:page:2147","kind":"lcd-page","source_ref":{"authority":"repo.lcd-uba-knowledgebase","object_id":"page:2147","url":"https://lcd.exactas.uba.ar/temas-de-tesis-de-licenciatura-bak/"},"subtitle":"page","tags":[],"title":"Cartelera de temas de tesis de licenciatura – BAK"},{"canonical_url":"https://lcd.exactas.uba.ar/archivo-de-tesis-de-licenciatura-bak/","contributors":[],"facets":{"entity_type":"page"},"item_id":"lcd:page:2562","kind":"lcd-page","source_ref":{"authority":"repo.lcd-uba-knowledgebase","object_id":"page:2562","url":"https://lcd.exactas.uba.ar/archivo-de-tesis-de-licenciatura-bak/"},"subtitle":"page","tags":[],"title":"Archivo de tesis de licenciatura – BAK"}],"payload_sha256":"01bbef6b349aefeacadb64a85641e634f3ee03d291bf15e8189be1110e80aef5","release_id":"sha256:01bbef6b349aefea","schema_id":"knowledge.collection-release","schema_version":1,"source":{"adapter":"lcd-title-slug-index","authority":"repo.lcd-uba-knowledgebase","path":"source/title_slug_index.json","release_id":"run:kx_live_lcd_pages_20260829T221634Z;git:dcaa61e338b284d43764b9c06a0f112629e958f6","sha256":"66898ae81d7203bac9e7ca77ed3139dced8ff6c2c9f3c1855a88f1a13861a2a2"},"spec_sha256":"c40bcf76da867f7fddc65bf25c8d83df841b4a6e1bd2ace0c1253dac93ee0168","title":"LCD — thesis resources"}
