{"collection_id":"aggregation-public-explainer","description":"A public-safe guide to Matías Iglesias's governed research notes on aggregation and aggregate volatility. Each card links to the source note that supports it.","items":[{"canonical_url":"https://github.com/matuteiglesias/thesis/blob/7265018750db0f96b69efd4048aedad06ad803fc/docs/Aggregation/chapter1_08.md","contributors":["Matías Iglesias"],"facets":{"explainer_section":"Question"},"item_id":"repo.thesis:aggregation-question","kind":"research-explainer-section","source_ref":{"authority":"repo.thesis","object_id":"docs/Aggregation/chapter1_08.md","url":"https://github.com/matuteiglesias/thesis/blob/7265018750db0f96b69efd4048aedad06ad803fc/docs/Aggregation/chapter1_08.md"},"summary":"Why do aggregate fluctuations remain substantial when many individual shocks might appear to cancel out?","tags":["aggregation","volatility"],"title":"Question"},{"canonical_url":"https://github.com/matuteiglesias/thesis/blob/7265018750db0f96b69efd4048aedad06ad803fc/docs/Aggregation/chapter1_04.md","contributors":["Matías Iglesias"],"facets":{"explainer_section":"Why it matters"},"item_id":"repo.thesis:aggregation-why","kind":"research-explainer-section","source_ref":{"authority":"repo.thesis","object_id":"docs/Aggregation/chapter1_04.md","url":"https://github.com/matuteiglesias/thesis/blob/7265018750db0f96b69efd4048aedad06ad803fc/docs/Aggregation/chapter1_04.md"},"summary":"The research notes frame aggregation as a problem for interpreting macroeconomic volatility from firm-level evidence rather than assuming a representative agent explains all movement.","tags":["macroeconomics","aggregation"],"title":"Why it matters"},{"canonical_url":"https://github.com/matuteiglesias/thesis/blob/7265018750db0f96b69efd4048aedad06ad803fc/docs/Aggregation/chapter1_02.md","contributors":["Matías Iglesias"],"facets":{"explainer_section":"Evidence/data"},"item_id":"repo.thesis:aggregation-evidence","kind":"research-explainer-section","source_ref":{"authority":"repo.thesis","object_id":"docs/Aggregation/chapter1_02.md","url":"https://github.com/matuteiglesias/thesis/blob/7265018750db0f96b69efd4048aedad06ad803fc/docs/Aggregation/chapter1_02.md"},"summary":"The governed programme links detailed firm-level exports, imports and fluctuations to aggregate outcomes; this release is an explanatory index, not a new empirical estimate.","tags":["firm-data","evidence"],"title":"Evidence and data"},{"canonical_url":"https://github.com/matuteiglesias/thesis/blob/7265018750db0f96b69efd4048aedad06ad803fc/docs/Aggregation/chapter1_09.md","contributors":["Matías Iglesias"],"facets":{"explainer_section":"Method/design"},"item_id":"repo.thesis:aggregation-method","kind":"research-explainer-section","source_ref":{"authority":"repo.thesis","object_id":"docs/Aggregation/chapter1_09.md","url":"https://github.com/matuteiglesias/thesis/blob/7265018750db0f96b69efd4048aedad06ad803fc/docs/Aggregation/chapter1_09.md"},"summary":"The source programme studies aggregation formally, with attention to distributions of firm size and fluctuations and to how covariance and network structure affect aggregation.","tags":["method","networks"],"title":"Method and design"},{"canonical_url":"https://github.com/matuteiglesias/thesis/blob/7265018750db0f96b69efd4048aedad06ad803fc/docs/Aggregation/chapter1_08.md","contributors":["Matías Iglesias"],"facets":{"explainer_section":"Main findings"},"item_id":"repo.thesis:aggregation-finding","kind":"research-explainer-section","source_ref":{"authority":"repo.thesis","object_id":"docs/Aggregation/chapter1_08.md","url":"https://github.com/matuteiglesias/thesis/blob/7265018750db0f96b69efd4048aedad06ad803fc/docs/Aggregation/chapter1_08.md"},"summary":"The source notes explain that large or granular firms and non-cancelling dependence can sustain aggregate volatility; this is a source-linked research proposition, not a newly calculated result in this experience.","tags":["granularity","volatility"],"title":"Main finding"},{"canonical_url":"https://github.com/matuteiglesias/thesis/blob/7265018750db0f96b69efd4048aedad06ad803fc/docs/Aggregation/chapter1_05.md","contributors":["Matías Iglesias"],"facets":{"explainer_section":"Limitations"},"item_id":"repo.thesis:aggregation-limitations","kind":"research-explainer-section","source_ref":{"authority":"repo.thesis","object_id":"docs/Aggregation/chapter1_05.md","url":"https://github.com/matuteiglesias/thesis/blob/7265018750db0f96b69efd4048aedad06ad803fc/docs/Aggregation/chapter1_05.md"},"summary":"This experience preserves links to governed source notes and their pinned source commit. It does not replace the research programme, reproduce its full derivations, or claim official statistics or a new causal estimate.","tags":["provenance","limitations"],"title":"Credibility, limitations and provenance"}],"payload_sha256":"e14a4ad79268dee768795f0f2e31620e7ac0ac949346ead251f5bd636308f362","release_id":"sha256:e14a4ad79268dee7","schema_id":"knowledge.collection-release","schema_version":1,"source":{"adapter":"jsonl","authority":"repo.thesis","path":"source/items.jsonl","release_id":"git:7265018750db0f96b69efd4048aedad06ad803fc","sha256":"100bf98b0f0df05c6a735dbed58c5b3826528c61100da15d2f65ab242f415535"},"spec_sha256":"571ef07ddf2a3df47524679c32ba2ab921e3b70aeecba0f17a3e9657918ac7ef","title":"Why can individual shocks move the aggregate?"}
